{
  "version": "0.1.0",
  "uf": "SE",
  "cityId": "2800308",
  "name": "Aracaju",
  "generatedAt": "2026-05-04T06:16:23Z",
  "territorialHealthScore": 55,
  "verdict": "inconclusivo",
  "confidence": "media",
  "indicators": [
    {
      "id": "population_2022",
      "label": "População residente",
      "value": 602757,
      "unit": "pessoas",
      "year": 2022,
      "kind": "measured",
      "direction": "unknown",
      "sources": ["ibge-sidra-4714-aracaju-pop-2022"]
    },
    {
      "id": "gdp_current_2023",
      "label": "PIB corrente",
      "value": 22291877000,
      "unit": "R$",
      "year": 2023,
      "kind": "measured",
      "direction": "up",
      "sources": ["ibge-sidra-5938-aracaju-pib-2002-2023"]
    },
    {
      "id": "gdp_per_capita_proxy_2023",
      "label": "PIB corrente por habitante",
      "value": 36983.19,
      "unit": "R$/habitante",
      "year": 2023,
      "kind": "proxy",
      "direction": "unknown",
      "sources": ["ibge-sidra-5938-aracaju-pib-2002-2023", "ibge-sidra-4714-aracaju-pop-2022"]
    },
    {
      "id": "gdp_nominal_growth_2022_2023",
      "label": "Crescimento nominal do PIB",
      "value": 8.19,
      "unit": "%",
      "year": 2023,
      "kind": "proxy",
      "direction": "up",
      "sources": ["ibge-sidra-5938-aracaju-pib-2002-2023"]
    },
    {
      "id": "territorial_role",
      "label": "Papel territorial",
      "value": 1,
      "unit": "capital estadual",
      "year": 2026,
      "kind": "measured",
      "direction": "stable",
      "sources": ["ibge-localidades-aracaju"]
    }
  ],
  "diagnostics": {
    "strengths": [
      "Capital estadual e principal centralidade administrativa de Sergipe.",
      "PIB corrente municipal com série oficial longa disponível no SIDRA.",
      "Escala populacional suficiente para testar oportunidades urbanas sem complexidade de megalópole."
    ],
    "weaknesses": [
      "O pacote inicial ainda não inclui renda, emprego formal, educação, saúde, mobilidade, segurança e dados por bairro.",
      "PIB corrente municipal não mostra distribuição territorial da atividade econômica.",
      "Oportunidades de negócio ainda são hipóteses, não recomendações de investimento."
    ],
    "opportunities": [
      "Criar primeira leitura municipal pública do Atlas Sim.",
      "Testar simulação de serviços de proximidade como farmácia, padaria, clínica e cursos técnicos.",
      "Conectar capital e municípios-polo de Sergipe em uma rede territorial comparável."
    ],
    "risks": [
      "Confundir centralidade de capital com oportunidade homogênea em todos os bairros.",
      "Transformar crescimento nominal do PIB em conclusão social ampla.",
      "Publicar recomendação comercial sem dados de demanda, renda, concorrência e fluxo."
    ],
    "limitations": [
      "Veredito inconclusivo por falta de dados setoriais e intramunicipais.",
      "Score inicial é heurístico e não indicador oficial.",
      "Não há análise por bairro nesta versão."
    ]
  },
  "sources": [
    {
      "id": "ibge-sidra-4714-aracaju-pop-2022",
      "label": "IBGE/SIDRA Tabela 4714 - População residente de Aracaju, Censo Demográfico 2022",
      "url": "https://apisidra.ibge.gov.br/values/t/4714/n6/2800308/v/93/p/2022",
      "accessedAt": "2026-05-04T06:16:23Z"
    },
    {
      "id": "ibge-sidra-5938-aracaju-pib-2002-2023",
      "label": "IBGE/SIDRA Tabela 5938 - PIB corrente de Aracaju",
      "url": "https://apisidra.ibge.gov.br/values/t/5938/n6/2800308/v/37/p/all",
      "accessedAt": "2026-05-04T06:16:23Z"
    },
    {
      "id": "ibge-localidades-aracaju",
      "label": "IBGE API de Localidades - Município de Aracaju",
      "url": "https://servicodados.ibge.gov.br/api/v1/localidades/municipios/2800308",
      "accessedAt": "2026-05-04T06:16:23Z"
    }
  ]
}
