{
  "version": "0.1.0",
  "uf": "SE",
  "cityId": "2802908",
  "name": "Itabaiana",
  "generatedAt": "2026-05-04T06:26:42Z",
  "territorialHealthScore": 57,
  "verdict": "inconclusivo",
  "confidence": "media",
  "indicators": [
    {
      "id": "population_2022",
      "label": "População residente",
      "value": 103440,
      "unit": "pessoas",
      "year": 2022,
      "kind": "measured",
      "direction": "unknown",
      "sources": ["ibge-sidra-4714-itabaiana-pop-2022"]
    },
    {
      "id": "gdp_current_2023",
      "label": "PIB corrente",
      "value": 2942686000,
      "unit": "R$",
      "year": 2023,
      "kind": "measured",
      "direction": "up",
      "sources": ["ibge-sidra-5938-itabaiana-pib-2002-2023"]
    },
    {
      "id": "gdp_per_capita_proxy_2023",
      "label": "PIB corrente por habitante",
      "value": 28448.24,
      "unit": "R$/habitante",
      "year": 2023,
      "kind": "proxy",
      "direction": "unknown",
      "sources": ["ibge-sidra-5938-itabaiana-pib-2002-2023", "ibge-sidra-4714-itabaiana-pop-2022"]
    },
    {
      "id": "gdp_nominal_growth_2022_2023",
      "label": "Crescimento nominal do PIB",
      "value": 17.23,
      "unit": "%",
      "year": 2023,
      "kind": "proxy",
      "direction": "up",
      "sources": ["ibge-sidra-5938-itabaiana-pib-2002-2023"]
    },
    {
      "id": "territorial_role",
      "label": "Papel territorial",
      "value": 1,
      "unit": "região imediata",
      "year": 2026,
      "kind": "measured",
      "direction": "stable",
      "sources": ["ibge-localidades-itabaiana"]
    }
  ],
  "diagnostics": {
    "strengths": [
      "Município-polo da região imediata de Itabaiana, permitindo comparação fora da capital.",
      "Crescimento nominal do PIB 2022-2023 acima de Aracaju nesta primeira leitura.",
      "Escala municipal adequada para testar hipóteses de comércio regional e serviços de proximidade."
    ],
    "weaknesses": [
      "O pacote inicial ainda não inclui emprego, renda, educação, saúde, mobilidade, segurança e concorrência.",
      "PIB corrente e crescimento nominal não provam melhora real per capita.",
      "Sem dados intraurbanos, não é possível apontar onde abrir negócio."
    ],
    "opportunities": [
      "Comparar capitalidade de Aracaju com centralidade regional de Itabaiana.",
      "Testar hipóteses de comércio, logística curta, serviços técnicos e formação profissional.",
      "Construir ranking público de municípios-polo de Sergipe."
    ],
    "risks": [
      "Confundir crescimento nominal expressivo com boom real sustentável.",
      "Subestimar vulnerabilidades rurais e dependências regionais.",
      "Gerar recomendação comercial sem dados de fluxo, renda, concorrência e custos."
    ],
    "limitations": [
      "Veredito inconclusivo por falta de dados setoriais.",
      "Score inicial é heurístico e não indicador oficial.",
      "Não há análise por bairro, povoado ou zona comercial nesta versão."
    ]
  },
  "sources": [
    {
      "id": "ibge-sidra-4714-itabaiana-pop-2022",
      "label": "IBGE/SIDRA Tabela 4714 - População residente de Itabaiana, Censo Demográfico 2022",
      "url": "https://apisidra.ibge.gov.br/values/t/4714/n6/2802908/v/93/p/2022",
      "accessedAt": "2026-05-04T06:26:42Z"
    },
    {
      "id": "ibge-sidra-5938-itabaiana-pib-2002-2023",
      "label": "IBGE/SIDRA Tabela 5938 - PIB corrente de Itabaiana",
      "url": "https://apisidra.ibge.gov.br/values/t/5938/n6/2802908/v/37/p/all",
      "accessedAt": "2026-05-04T06:26:42Z"
    },
    {
      "id": "ibge-localidades-itabaiana",
      "label": "IBGE API de Localidades - Município de Itabaiana",
      "url": "https://servicodados.ibge.gov.br/api/v1/localidades/municipios/2802908",
      "accessedAt": "2026-05-04T06:26:42Z"
    }
  ]
}
